{
  "$schema": "./schemas/contracts-manifest-v1.schema.json",
  "manifest_schema": "contracts-manifest.v1",
  "release_version": "1.3.0",
  "status": "draft",
  "contracts": {
    "qfen": {
      "id": "qfen.v1",
      "major": 1,
      "schema": "schemas/qfen-v1.schema.json",
      "docs": "docs/game-state.md"
    },
    "bitboard": {
      "id": "bitboard.v1",
      "major": 1,
      "schema": "schemas/bitboard-v1.schema.json",
      "docs": "docs/game-state.md"
    },
    "action_index": {
      "id": "action-index.v1",
      "major": 1,
      "schema": null,
      "docs": "docs/game-state.md"
    },
    "symmetry_fixtures": {
      "id": "symmetry-fixtures.v1",
      "major": 1,
      "schema": "schemas/symmetry-fixtures-v1.schema.json",
      "docs": "docs/symmetry-transposition.md"
    },
    "invalid_state_fixtures": {
      "id": "invalid-state-fixtures.v1",
      "major": 1,
      "schema": "schemas/invalid-state-fixtures-v1.schema.json",
      "docs": "docs/game-state.md"
    },
    "selfplay": {
      "id": "selfplay.v1",
      "major": 1,
      "schema": "schemas/selfplay-v1.schema.json",
      "docs": "docs/selfplay-v1.md",
      "fixture_glob": "fixtures/selfplay/*.jsonl"
    },
    "tensor_board": {
      "id": "tensor-board.v1",
      "major": 1,
      "schema": null,
      "docs": "docs/storage-representations.md"
    },
    "arrow_parquet_selfplay": {
      "id": "arrow-parquet-selfplay.v1",
      "major": 1,
      "schema": "schemas/arrow-parquet-selfplay-v1.json",
      "docs": "docs/storage-representations.md"
    },
    "opening_book": {
      "id": "opening-book.v1",
      "major": 1,
      "schema": "schemas/opening-book-v1.json",
      "docs": "docs/opening-book-v1.md"
    },
    "opening_book_summary": {
      "id": "opening-book-summary.v1",
      "major": 1,
      "schema": "schemas/opening-book-summary-v1.json",
      "docs": "docs/opening-book-summary-v1.md"
    },
    "observation": {
      "id": "observation.v1",
      "major": 1,
      "schema": "schemas/observation-v1.json",
      "docs": "docs/observation-v1.md"
    },
    "game_result": {
      "id": "game-result.v1",
      "major": 1,
      "schema": "schemas/game-result-v1.json",
      "docs": "docs/game-result-v1.md"
    },
    "model_checkpoint": {
      "id": "model-checkpoint.v1",
      "major": 1,
      "schema": "schemas/model-checkpoint-v1.json",
      "docs": "docs/model-checkpoint-v1.md"
    },
    "search_summary": {
      "id": "search-summary.v1",
      "major": 1,
      "schema": "schemas/search-summary-v1.json",
      "docs": "docs/search-summary-v1.md",
      "fixture_glob": "fixtures/search-summary/*.jsonl"
    },
    "engine_request": {
      "id": "engine-request.v1",
      "major": 1,
      "schema": "schemas/engine-request-v1.json",
      "docs": "docs/engine-request-v1.md",
      "fixture_glob": "fixtures/engine-request/*.jsonl"
    },
    "engine_response": {
      "id": "engine-response.v1",
      "major": 1,
      "schema": "schemas/engine-response-v1.json",
      "docs": "docs/engine-response-v1.md",
      "fixture_glob": "fixtures/engine-response/*.jsonl"
    }
  },
  "implementation_expectations": {
    "python": {
      "package": "quantik-core",
      "recommended_constant": "SUPPORTED_CONTRACTS",
      "minimum_expected_contract_release": "1.3.0"
    },
    "rust": {
      "crate": "quantik-core",
      "recommended_constant": "SUPPORTED_CONTRACTS",
      "minimum_expected_contract_release": "1.3.0"
    }
  }
}
